[
  {
    "schema_version": 1,
    "correlation_id": "gateway",
    "generation_id": "33333333-3333-4333-8333-333333333333",
    "sequence": 1,
    "event": "gateway.starting",
    "data": {
      "runtime_id": "33333333-3333-4333-8333-333333333333",
      "gateway_id": "fixture-gateway"
    },
    "runtime_generation": 1
  },
  {
    "schema_version": 1,
    "correlation_id": "gateway",
    "generation_id": "33333333-3333-4333-8333-333333333333",
    "sequence": 2,
    "event": "gateway.listening",
    "data": {
      "effective_address": "http://127.0.0.1:12345",
      "gateway_id": "fixture-gateway",
      "runtime_id": "33333333-3333-4333-8333-333333333333",
      "session_id": "33333333-3333-4333-8333-333333333333",
      "ready": false,
      "reason_code": "desktop.readiness_required"
    },
    "runtime_generation": 1
  },
  {
    "schema_version": 1,
    "correlation_id": "gateway",
    "generation_id": "33333333-3333-4333-8333-333333333333",
    "sequence": 3,
    "event": "gateway.status",
    "data": {
      "state": "listening",
      "effective_address": "http://127.0.0.1:12345",
      "ready": false,
      "reason_code": "desktop.readiness_required",
      "expires_at": "2030-01-01T00:00:00Z"
    },
    "runtime_generation": 1
  },
  {
    "schema_version": 1,
    "correlation_id": "gateway",
    "generation_id": "33333333-3333-4333-8333-333333333333",
    "sequence": 4,
    "event": "gateway.stopping",
    "data": {},
    "runtime_generation": 1
  },
  {
    "schema_version": 1,
    "correlation_id": "gateway",
    "generation_id": "33333333-3333-4333-8333-333333333333",
    "sequence": 5,
    "event": "gateway.stopped",
    "data": {},
    "runtime_generation": 1
  },
  {
    "schema_version": 1,
    "correlation_id": "gateway",
    "generation_id": "33333333-3333-4333-8333-333333333333",
    "sequence": 6,
    "event": "credential.expired",
    "data": {
      "runtime_id": "33333333-3333-4333-8333-333333333333"
    },
    "runtime_generation": 1
  },
  {
    "schema_version": 1,
    "correlation_id": "gateway",
    "generation_id": "33333333-3333-4333-8333-333333333333",
    "sequence": 7,
    "event": "error",
    "data": {
      "code": "desktop.invalid_gateway_command",
      "retryable": false
    },
    "runtime_generation": 1
  }
]
